"EQJAYEZD","preprint","2024","Wu, Fangzhou; Wu, Shutong; Cao, Yulong; Xiao, Chaowei","WIPI: A New Web Threat for LLM-Driven Web Agents","","","","10.48550/arXiv.2402.16965","http://arxiv.org/abs/2402.16965","With the fast development of large language models (LLMs), LLM-driven Web Agents (Web Agents for short) have obtained tons of attention due to their superior capability where LLMs serve as the core part of making decisions like the human brain equipped with multiple web tools to actively interact with external deployed websites. As uncountable Web Agents have been released and such LLM systems are experiencing rapid development and drawing closer to widespread deployment in our daily lives, an essential and pressing question arises: ""Are these Web Agents secure?"". In this paper, we introduce a novel threat, WIPI, that indirectly controls Web Agent to execute malicious instructions embedded in publicly accessible webpages. To launch a successful WIPI works in a black-box environment. This methodology focuses on the form and content of indirect instructions within external webpages, enhancing the efficiency and stealthiness of the attack. To evaluate the effectiveness of the proposed methodology, we conducted extensive experiments using 7 plugin-based ChatGPT Web Agents, 8 Web GPTs, and 3 different open-source Web Agents. The results reveal that our methodology achieves an average attack success rate (ASR) exceeding 90% even in pure black-box scenarios. Moreover, through an ablation study examining various user prefix instructions, we demonstrated that the WIPI exhibits strong robustness, maintaining high performance across diverse prefix instructions.","2024-02-26","2024-12-31 01:55:33","2024-12-31 01:55:33","2024-12-31 01:55:32","","","","","","","WIPI","","","","","arXiv","","","","","","","arXiv.org","","arXiv:2402.16965 [cs]","","D:\Program Files\Zotero\File\storage\AD75L6FR\2402.html; D:\Program Files\Zotero\File\storage\ZTSAQC6Y\Wu 等 - 2024 - WIPI A New Web Threat for LLM-Driven Web Agents.pdf","","","Computer Science - Artificial Intelligence; Computer Science - Cryptography and Security","","","","","","","","","","","","","","","","","","","arXiv:2402.16965","","","","","","","","","","","","","","","","","","","","","","","","","","",""
"I558P9PQ","preprint","2024","Jiao, Ruochen; Xie, Shaoyuan; Yue, Justin; Sato, Takami; Wang, Lixu; Wang, Yixuan; Chen, Qi Alfred; Zhu, Qi","Can We Trust Embodied Agents? Exploring Backdoor Attacks against Embodied LLM-based Decision-Making Systems","","","","10.48550/arXiv.2405.20774","http://arxiv.org/abs/2405.20774","Large Language Models (LLMs) have shown significant promise in real-world decision-making tasks for embodied artificial intelligence, especially when fine-tuned to leverage their inherent common sense and reasoning abilities while being tailored to specific applications. However, this fine-tuning process introduces considerable safety and security vulnerabilities, especially in safety-critical cyber-physical systems. In this work, we propose the first comprehensive framework for Backdoor Attacks against LLM-based Decision-making systems (BALD) in embodied AI, systematically exploring the attack surfaces and trigger mechanisms. Specifically, we propose three distinct attack mechanisms: word injection, scenario manipulation, and knowledge injection, targeting various components in the LLM-based decision-making pipeline. We perform extensive experiments on representative LLMs (GPT-3.5, LLaMA2, PaLM2) in autonomous driving and home robot tasks, demonstrating the effectiveness and stealthiness of our backdoor triggers across various attack channels, with cases like vehicles accelerating toward obstacles and robots placing knives on beds. Our word and knowledge injection attacks achieve nearly 100% success rate across multiple models and datasets while requiring only limited access to the system. Our scenario manipulation attack yields success rates exceeding 65%, reaching up to 90%, and does not require any runtime system intrusion. We also assess the robustness of these attacks against defenses, revealing their resilience. Our findings highlight critical security vulnerabilities in embodied LLM systems and emphasize the urgent need for safeguarding these systems to mitigate potential risks.","2024-10-05","2024-12-31 01:55:27","2024-12-31 01:55:27","2024-12-31 01:55:27","","","","","","","Can We Trust Embodied Agents?","","","","","arXiv","","","","","","","arXiv.org","","arXiv:2405.20774 [cs]","","D:\Program Files\Zotero\File\storage\J7QXSJBC\Jiao 等 - 2024 - Can We Trust Embodied Agents Exploring Backdoor Attacks against Embodied LLM-based Decision-Making.pdf; D:\Program Files\Zotero\File\storage\8Z9VFXPW\2405.html","","","Computer Science - Artificial Intelligence; Computer Science - Cryptography and Security","","","","","","","","","","","","","","","","","","","arXiv:2405.20774","","","","","","","","","","","","","","","","","","","","","","","","","","",""
"GFH4K2LB","preprint","2024","Stefano, Gianluca De; Schönherr, Lea; Pellegrino, Giancarlo","Rag and Roll: An End-to-End Evaluation of Indirect Prompt Manipulations in LLM-based Application Frameworks","","","","10.48550/arXiv.2408.05025","http://arxiv.org/abs/2408.05025","Retrieval Augmented Generation (RAG) is a technique commonly used to equip models with out of distribution knowledge. This process involves collecting, indexing, retrieving, and providing information to an LLM for generating responses. Despite its growing popularity due to its flexibility and low cost, the security implications of RAG have not been extensively studied. The data for such systems are often collected from public sources, providing an attacker a gateway for indirect prompt injections to manipulate the responses of the model. In this paper, we investigate the security of RAG systems against end-to-end indirect prompt manipulations. First, we review existing RAG framework pipelines, deriving a prototypical architecture and identifying critical parameters. We then examine prior works searching for techniques that attackers can use to perform indirect prompt manipulations. Finally, we implemented Rag 'n Roll, a framework to determine the effectiveness of attacks against end-to-end RAG applications. Our results show that existing attacks are mostly optimized to boost the ranking of malicious documents during the retrieval phase. However, a higher rank does not immediately translate into a reliable attack. Most attacks, against various configurations, settle around a 40% success rate, which could rise to 60% when considering ambiguous answers as successful attacks (those that include the expected benign one as well). Additionally, when using unoptimized documents, attackers deploying two of them (or more) for a target query can achieve similar results as those using optimized ones. Finally, exploration of the configuration space of a RAG showed limited impact in thwarting the attacks, where the most successful combination severely undermines functionality.","2024-08-12","2024-12-31 01:55:24","2024-12-31 01:55:24","2024-12-31 01:55:24","","","","","","","Rag and Roll","","","","","arXiv","","","","","","","arXiv.org","","arXiv:2408.05025 [cs]","","D:\Program Files\Zotero\File\storage\H7M7B7HA\2408.html; D:\Program Files\Zotero\File\storage\LK3LE3W6\Stefano 等 - 2024 - Rag and Roll An End-to-End Evaluation of Indirect Prompt Manipulations in LLM-based Application Fra.pdf","","","Computer Science - Artificial Intelligence; Computer Science - Cryptography and Security","","","","","","","","","","","","","","","","","","","arXiv:2408.05025","","","","","","","","","","","","","","","","","","","","","","","","","","",""
"5MB85D5K","preprint","2024","Cho, Sukmin; Jeong, Soyeong; Seo, Jeongyeon; Hwang, Taeho; Park, Jong C.","Typos that Broke the RAG's Back: Genetic Attack on RAG Pipeline by Simulating Documents in the Wild via Low-level Perturbations","","","","10.48550/arXiv.2404.13948","http://arxiv.org/abs/2404.13948","The robustness of recent Large Language Models (LLMs) has become increasingly crucial as their applicability expands across various domains and real-world applications. Retrieval-Augmented Generation (RAG) is a promising solution for addressing the limitations of LLMs, yet existing studies on the robustness of RAG often overlook the interconnected relationships between RAG components or the potential threats prevalent in real-world databases, such as minor textual errors. In this work, we investigate two underexplored aspects when assessing the robustness of RAG: 1) vulnerability to noisy documents through low-level perturbations and 2) a holistic evaluation of RAG robustness. Furthermore, we introduce a novel attack method, the Genetic Attack on RAG (\textit{GARAG}), which targets these aspects. Specifically, GARAG is designed to reveal vulnerabilities within each component and test the overall system functionality against noisy documents. We validate RAG robustness by applying our \textit{GARAG} to standard QA datasets, incorporating diverse retrievers and LLMs. The experimental results show that GARAG consistently achieves high attack success rates. Also, it significantly devastates the performance of each component and their synergy, highlighting the substantial risk that minor textual inaccuracies pose in disrupting RAG systems in the real world.","2024-10-22","2024-12-31 01:55:21","2024-12-31 01:55:21","2024-12-31 01:55:21","","","","","","","Typos that Broke the RAG's Back","","","","","arXiv","","","","","","","arXiv.org","","arXiv:2404.13948 [cs]","","D:\Program Files\Zotero\File\storage\FRY2CRI7\Cho 等 - 2024 - Typos that Broke the RAG's Back Genetic Attack on RAG Pipeline by Simulating Documents in the Wild.pdf; D:\Program Files\Zotero\File\storage\6LFZSF8H\2404.html","","","Computer Science - Computation and Language","","","","","","","","","","","","","","","","","","","arXiv:2404.13948","","","","","","","","","","","","","","","","","","","","","","","","","","",""
"2PADKYYI","preprint","2024","Zhang, Quan; Zeng, Binqi; Zhou, Chijin; Go, Gwihwan; Shi, Heyuan; Jiang, Yu","Human-Imperceptible Retrieval Poisoning Attacks in LLM-Powered Applications","","","","10.48550/arXiv.2404.17196","http://arxiv.org/abs/2404.17196","Presently, with the assistance of advanced LLM application development frameworks, more and more LLM-powered applications can effortlessly augment the LLMs' knowledge with external content using the retrieval augmented generation (RAG) technique. However, these frameworks' designs do not have sufficient consideration of the risk of external content, thereby allowing attackers to undermine the applications developed with these frameworks. In this paper, we reveal a new threat to LLM-powered applications, termed retrieval poisoning, where attackers can guide the application to yield malicious responses during the RAG process. Specifically, through the analysis of LLM application frameworks, attackers can craft documents visually indistinguishable from benign ones. Despite the documents providing correct information, once they are used as reference sources for RAG, the application is misled into generating incorrect responses. Our preliminary experiments indicate that attackers can mislead LLMs with an 88.33\% success rate, and achieve a 66.67\% success rate in the real-world application, demonstrating the potential impact of retrieval poisoning.","2024-04-26","2024-12-31 01:55:18","2024-12-31 01:55:18","2024-12-31 01:55:18","","","","","","","","","","","","arXiv","","","","","","","arXiv.org","","arXiv:2404.17196 [cs]","","D:\Program Files\Zotero\File\storage\RLGEMACB\2404.html; D:\Program Files\Zotero\File\storage\5XSLXXVC\Zhang 等 - 2024 - Human-Imperceptible Retrieval Poisoning Attacks in LLM-Powered Applications.pdf","","","Computer Science - Artificial Intelligence; Computer Science - Cryptography and Security","","","","","","","","","","","","","","","","","","","arXiv:2404.17196","","","","","","","","","","","","","","","","","","","","","","","","","","",""
"U6HGFK8H","preprint","2024","Chaudhari, Harsh; Severi, Giorgio; Abascal, John; Jagielski, Matthew; Choquette-Choo, Christopher A.; Nasr, Milad; Nita-Rotaru, Cristina; Oprea, Alina","Phantom: General Trigger Attacks on Retrieval Augmented Language Generation","","","","10.48550/arXiv.2405.20485","http://arxiv.org/abs/2405.20485","Retrieval Augmented Generation (RAG) expands the capabilities of modern large language models (LLMs), by anchoring, adapting, and personalizing their responses to the most relevant knowledge sources. It is particularly useful in chatbot applications, allowing developers to customize LLM output without expensive retraining. Despite their significant utility in various applications, RAG systems present new security risks. In this work, we propose new attack vectors that allow an adversary to inject a single malicious document into a RAG system's knowledge base, and mount a backdoor poisoning attack. We design Phantom, a general two-stage optimization framework against RAG systems, that crafts a malicious poisoned document leading to an integrity violation in the model's output. First, the document is constructed to be retrieved only when a specific trigger sequence of tokens appears in the victim's queries. Second, the document is further optimized with crafted adversarial text that induces various adversarial objectives on the LLM output, including refusal to answer, reputation damage, privacy violations, and harmful behaviors. We demonstrate our attacks on multiple LLM architectures, including Gemma, Vicuna, and Llama, and show that they transfer to GPT-3.5 Turbo and GPT-4. Finally, we successfully conducted a Phantom attack on NVIDIA's black-box production RAG system, ""Chat with RTX"".","2024-10-15","2024-12-31 01:55:15","2024-12-31 01:55:15","2024-12-31 01:55:15","","","","","","","Phantom","","","","","arXiv","","","","","","","arXiv.org","","arXiv:2405.20485 [cs]","","D:\Program Files\Zotero\File\storage\LCJ4HDJW\Chaudhari 等 - 2024 - Phantom General Trigger Attacks on Retrieval Augmented Language Generation.pdf; D:\Program Files\Zotero\File\storage\THFC7V4J\2405.html","","","Computer Science - Computation and Language; Computer Science - Machine Learning; Computer Science - Cryptography and Security","","","","","","","","","","","","","","","","","","","arXiv:2405.20485","","","","","","","","","","","","","","","","","","","","","","","","","","",""
"E7VM63FX","preprint","2024","Tan, Zhen; Zhao, Chengshuai; Moraffah, Raha; Li, Yifan; Wang, Song; Li, Jundong; Chen, Tianlong; Liu, Huan","""Glue pizza and eat rocks"" -- Exploiting Vulnerabilities in Retrieval-Augmented Generative Models","","","","10.48550/arXiv.2406.19417","http://arxiv.org/abs/2406.19417","Retrieval-Augmented Generative (RAG) models enhance Large Language Models (LLMs) by integrating external knowledge bases, improving their performance in applications like fact-checking and information searching. In this paper, we demonstrate a security threat where adversaries can exploit the openness of these knowledge bases by injecting deceptive content into the retrieval database, intentionally changing the model's behavior. This threat is critical as it mirrors real-world usage scenarios where RAG systems interact with publicly accessible knowledge bases, such as web scrapings and user-contributed data pools. To be more realistic, we target a realistic setting where the adversary has no knowledge of users' queries, knowledge base data, and the LLM parameters. We demonstrate that it is possible to exploit the model successfully through crafted content uploads with access to the retriever. Our findings emphasize an urgent need for security measures in the design and deployment of RAG systems to prevent potential manipulation and ensure the integrity of machine-generated content.","2024-06-26","2024-12-31 01:55:11","2024-12-31 01:55:11","2024-12-31 01:55:11","","","","","","","","","","","","arXiv","","","","","","","arXiv.org","","arXiv:2406.19417 [cs]","","D:\Program Files\Zotero\File\storage\XRPWIEQW\2406.html; D:\Program Files\Zotero\File\storage\KGEFL3RB\Tan 等 - 2024 - Glue pizza and eat rocks -- Exploiting Vulnerabilities in Retrieval-Augmented Generative Models.pdf","","","Computer Science - Artificial Intelligence; Computer Science - Cryptography and Security","","","","","","","","","","","","","","","","","","","arXiv:2406.19417","","","","","","","","","","","","","","","","","","","","","","","","","","",""
"RB7XNXHL","preprint","2024","Xue, Jiaqi; Zheng, Mengxin; Hu, Yebowen; Liu, Fei; Chen, Xun; Lou, Qian","BadRAG: Identifying Vulnerabilities in Retrieval Augmented Generation of Large Language Models","","","","10.48550/arXiv.2406.00083","http://arxiv.org/abs/2406.00083","Large Language Models (LLMs) are constrained by outdated information and a tendency to generate incorrect data, commonly referred to as ""hallucinations."" Retrieval-Augmented Generation (RAG) addresses these limitations by combining the strengths of retrieval-based methods and generative models. This approach involves retrieving relevant information from a large, up-to-date dataset and using it to enhance the generation process, leading to more accurate and contextually appropriate responses. Despite its benefits, RAG introduces a new attack surface for LLMs, particularly because RAG databases are often sourced from public data, such as the web. In this paper, we propose \TrojRAG{} to identify the vulnerabilities and attacks on retrieval parts (RAG database) and their indirect attacks on generative parts (LLMs). Specifically, we identify that poisoning several customized content passages could achieve a retrieval backdoor, where the retrieval works well for clean queries but always returns customized poisoned adversarial queries. Triggers and poisoned passages can be highly customized to implement various attacks. For example, a trigger could be a semantic group like ""The Republican Party, Donald Trump, etc."" Adversarial passages can be tailored to different contents, not only linked to the triggers but also used to indirectly attack generative LLMs without modifying them. These attacks can include denial-of-service attacks on RAG and semantic steering attacks on LLM generations conditioned by the triggers. Our experiments demonstrate that by just poisoning 10 adversarial passages can induce 98.2\% success rate to retrieve the adversarial passages. Then, these passages can increase the reject ratio of RAG-based GPT-4 from 0.01\% to 74.6\% or increase the rate of negative responses from 0.22\% to 72\% for targeted queries.","2024-06-06","2024-12-31 01:55:08","2024-12-31 01:55:08","2024-12-31 01:55:08","","","","","","","BadRAG","","","","","arXiv","","","","","","","arXiv.org","","arXiv:2406.00083 [cs]","","D:\Program Files\Zotero\File\storage\MLD2DX8C\2406.html; D:\Program Files\Zotero\File\storage\C7XXU7TQ\Xue 等 - 2024 - BadRAG Identifying Vulnerabilities in Retrieval Augmented Generation of Large Language Models.pdf","","","Computer Science - Artificial Intelligence; Computer Science - Computation and Language; Computer Science - Machine Learning; Computer Science - Cryptography and Security; Computer Science - Information Retrieval","","","","","","","","","","","","","","","","","","","arXiv:2406.00083","","","","","","","","","","","","","","","","","","","","","","","","","","",""
"832F7UFU","preprint","2024","Pasquini, Dario; Strohmeier, Martin; Troncoso, Carmela","Neural Exec: Learning (and Learning from) Execution Triggers for Prompt Injection Attacks","","","","10.48550/arXiv.2403.03792","http://arxiv.org/abs/2403.03792","We introduce a new family of prompt injection attacks, termed Neural Exec. Unlike known attacks that rely on handcrafted strings (e.g., ""Ignore previous instructions and...""), we show that it is possible to conceptualize the creation of execution triggers as a differentiable search problem and use learning-based methods to autonomously generate them. Our results demonstrate that a motivated adversary can forge triggers that are not only drastically more effective than current handcrafted ones but also exhibit inherent flexibility in shape, properties, and functionality. In this direction, we show that an attacker can design and generate Neural Execs capable of persisting through multi-stage preprocessing pipelines, such as in the case of Retrieval-Augmented Generation (RAG)-based applications. More critically, our findings show that attackers can produce triggers that deviate markedly in form and shape from any known attack, sidestepping existing blacklist-based detection and sanitation approaches.","2024-05-02","2024-12-31 01:55:02","2024-12-31 01:55:02","2024-12-31 01:55:02","","","","","","","Neural Exec","","","","","arXiv","","","","","","","arXiv.org","","arXiv:2403.03792 [cs]","","D:\Program Files\Zotero\File\storage\CYWGPHUL\Pasquini 等 - 2024 - Neural Exec Learning (and Learning from) Execution Triggers for Prompt Injection Attacks.pdf; D:\Program Files\Zotero\File\storage\92AMGS6U\2403.html","","","Computer Science - Machine Learning; Computer Science - Cryptography and Security","","","","","","","","","","","","","","","","","","","arXiv:2403.03792","","","","","","","","","","","","","","","","","","","","","","","","","","",""
"26J36PLW","preprint","2024","Chen, Zhaorun; Xiang, Zhen; Xiao, Chaowei; Song, Dawn; Li, Bo","AgentPoison: Red-teaming LLM Agents via Poisoning Memory or Knowledge Bases","","","","10.48550/arXiv.2407.12784","http://arxiv.org/abs/2407.12784","LLM agents have demonstrated remarkable performance across various applications, primarily due to their advanced capabilities in reasoning, utilizing external knowledge and tools, calling APIs, and executing actions to interact with environments. Current agents typically utilize a memory module or a retrieval-augmented generation (RAG) mechanism, retrieving past knowledge and instances with similar embeddings from knowledge bases to inform task planning and execution. However, the reliance on unverified knowledge bases raises significant concerns about their safety and trustworthiness. To uncover such vulnerabilities, we propose a novel red teaming approach AgentPoison, the first backdoor attack targeting generic and RAG-based LLM agents by poisoning their long-term memory or RAG knowledge base. In particular, we form the trigger generation process as a constrained optimization to optimize backdoor triggers by mapping the triggered instances to a unique embedding space, so as to ensure that whenever a user instruction contains the optimized backdoor trigger, the malicious demonstrations are retrieved from the poisoned memory or knowledge base with high probability. In the meantime, benign instructions without the trigger will still maintain normal performance. Unlike conventional backdoor attacks, AgentPoison requires no additional model training or fine-tuning, and the optimized backdoor trigger exhibits superior transferability, in-context coherence, and stealthiness. Extensive experiments demonstrate AgentPoison's effectiveness in attacking three types of real-world LLM agents: RAG-based autonomous driving agent, knowledge-intensive QA agent, and healthcare EHRAgent. On each agent, AgentPoison achieves an average attack success rate higher than 80% with minimal impact on benign performance (less than 1%) with a poison rate less than 0.1%.","2024-07-17","2024-12-31 01:54:21","2024-12-31 01:54:58","2024-12-31 01:54:21","","","","","","","AgentPoison","","","","","arXiv","","","","","","","arXiv.org","","arXiv:2407.12784 [cs]","","D:\Program Files\Zotero\File\storage\EDW4P3ZG\Chen 等 - 2024 - AgentPoison Red-teaming LLM Agents via Poisoning Memory or Knowledge Bases.pdf; D:\Program Files\Zotero\File\storage\ARL9RCXS\2407.html","","","Computer Science - Machine Learning; Computer Science - Cryptography and Security; Computer Science - Information Retrieval","","","","","","","","","","","","","","","","","","","arXiv:2407.12784","","","","","","","","","","","","","","","","","","","","","","","","","","",""